polarity,content,content_clean
1,"@ron_quintanilla @belecastillo jajajaja cual domingo ohhh, estos últimos días me han elotado",jajajaja cual domingo ohhh estos ltimos das me han elotado
0,"@ElCatoEnCorto @BooCr2012 @jchidalgo tengo criterios a favor y otros en contra, no lo tengo tan claro en cuanto al resultado final",tengo criterios a favor y otros en contra no lo tengo tan claro en cuanto al resultado final
0,"@Claudiosk_23 aguanten las canas en los hombres, deja de negarte! lo de calvo si ta complicado... jajaja",aguanten las canas en los hombres deja de negarte lo de calvo si ta complicado jajaja
1,Chema en esas y todos en la oficina deseando que vuelva a la oficina y a dirigir la empresa mejor...,chema en esas y todos en la oficina deseando que vuelva a la oficina y a dirigir la empresa mejor
-1,"Pobresita jajajaja, no no tendras su amistad de nuevo",pobresita jajajaja no no tendras su amistad de nuevo
0,"Había un sueño medio soñado, había un bueno, había un feo, había un malo",haba un sueo medio soado haba un bueno haba un feo haba un malo
-1,"@chrchaves jale, traidor, vendido a la corona española!",jale traidor vendido a la corona espaola
0,@Kloz234456 Al menos no quedan en ridículo como estos dudes,al menos no quedan en ridculo como estos dudes
-1,"Samantha dice de broma que nací castigada,pero a mi me parece muy real",samantha dice de broma que nac castigadapero a mi me parece muy real
-1,@alefpiro ¿Te fijaste en el detalle de que los viáticos de la edila los usó para invitar a cenar a un par de amigas no edilas?,te fijaste en el detalle de que los viticos de la edila los us para invitar a cenar a un par de amigas no edilas
1,"@TutzyFF jajaja que bueno verla anoche, que pases un excelente día",jajaja que bueno verla anoche que pases un excelente da
1,Fue MEJOR que algunas personas se fueran para conocer a otras,fue mejor que algunas personas se fueran para conocer a otras
-1,-Papá ¿Qué sale de cruzar un gato con un burro? -No lo sé. -Todos los vecinos a callar al gato JAJAJAJAJA no papá con el cinturón no,pap qu sale de cruzar un gato con un burro no lo s todos los vecinos a callar al gato jajajajaja no pap con el cinturn no
1,@faustoponce @ivoox Ok. Gracias. Ten un buen día.,ok gracias ten un buen da
1,Tumbes me trae buenos recuerdos,tumbes me trae buenos recuerdos
1,"Sé tan fuerte que nadie pueda herirte, tan noble que nadie pueda ofenderte y tan original que nadie pueda imitarte.",s tan fuerte que nadie pueda herirte tan noble que nadie pueda ofenderte y tan original que nadie pueda imitarte
1,"Bueno mi mama se quedo en casa acompañándolos, y bueno ella quiere ver Gisela, lo que tu desees madre! #nojuergahoy",bueno mi mama se quedo en casa acompandolos y bueno ella quiere ver gisela lo que tu desees madre nojuergahoy
-1,Tengo tremendos nervios con la defensa del proyecto de estudios económicos . No me la quiero llevar a exámenes,tengo tremendos nervios con la defensa del proyecto de estudios econmicos no me la quiero llevar a exmenes
-1,"ya se olvido de lo lindo q la pasabamos , manuel tenes que crecer vamoo q tenes casi 20 años no podes pensar en ella ya",ya se olvido de lo lindo q la pasabamos manuel tenes que crecer vamoo q tenes casi 20 aos no podes pensar en ella ya
1,Viendo la que será de hecho una de las sorpresas del cine peruano del 2017. Nueva sangre para renovar nuestra filmografía nacional,viendo la que ser de hecho una de las sorpresas del cine peruano del 2017 nueva sangre para renovar nuestra filmografa nacional
-1,@andreareyes6767 hola odiosa me hace falta,hola odiosa me hace falta
-1,"@lesliepenha estás loca, tú debes estar pendiente por si me dejan a última hora",ests loca t debes estar pendiente por si me dejan a ltima hora
0,Buena Galdos y eso q la conoces y te cae bien cuando se dara cuenta la flaca por su bien sin joda q va por mal camino,buena galdos y eso q la conoces y te cae bien cuando se dara cuenta la flaca por su bien sin joda q va por mal camino
0,"Elige amar, así duela, así parezca un imposible, así te tiemble el alma, así tengas miedo, así vayas a salir herida. El amor transforma",elige amar as duela as parezca un imposible as te tiemble el alma as tengas miedo as vayas a salir herida el amor transforma
1,No hay nada mejor que ver el estreno de #RogueOne con la mejor compañía,no hay nada mejor que ver el estreno de rogueone con la mejor compaa
-1,nadie quiere ir al prado,nadie quiere ir al prado
1,"Cuando estas bien con DIOS el enemigo te pone incapie en el camino, pero yo no tengo miedo por que mi FÉ esta en DIOS.",cuando estas bien con dios el enemigo te pone incapie en el camino pero yo no tengo miedo por que mi f esta en dios
-1,Me siento tan estúpido de haber abierto una herida ya cicatrizada a alguien que aún me sigue importando.... lo siento,me siento tan estpido de haber abierto una herida ya cicatrizada a alguien que an me sigue importando lo siento
-1,"@shakira no te puedo llevar en mi bicicleta. Me caí y está descompuesta. Happy to walk with you, tho.",no te puedo llevar en mi bicicleta me ca y est descompuesta happy to walk with you tho
-1,"Maldito maduro mil veces, por su culpa tuve que salir del país y alejarme de ella",maldito maduro mil veces por su culpa tuve que salir del pas y alejarme de ella
1,Dios guarda para mi lo mejor por que mi fe en el siempre perdurara por la eternidad. Quien busca encuentra y no se conforma con poco.,dios guarda para mi lo mejor por que mi fe en el siempre perdurara por la eternidad quien busca encuentra y no se conforma con poco
-1,"Todos queríamos ver las 2 ticas juntas en la final pero así es esto , ahora le toca a lei q avanza a la final #VISSLAISAworldjuniors",todos queramos ver las 2 ticas juntas en la final pero as es esto ahora le toca a lei q avanza a la final visslaisaworldjuniors
-1,@moboza pavas igual y no nos.dejaron irnos a la casa,pavas igual y no nosdejaron irnos a la casa
0,"@cantouchth no te disculpes por ser tú misma, eso está genial, en serio",no te disculpes por ser t misma eso est genial en serio
-1,"Lo peor es q las chicas piensan q es chiste, claro como no es chongo de ellas fresh, yo cargo con todo",lo peor es q las chicas piensan q es chiste claro como no es chongo de ellas fresh yo cargo con todo
1,@manuelchaplin ... Buena elección! Gracias por empujarme a verla antes que la saquen!,buena eleccin gracias por empujarme a verla antes que la saquen
-1,"Le fuí infiel a ""Don Escojale"", en verdad no lo vuelvo hacer",le fu infiel a don escojale en verdad no lo vuelvo hacer
-1,"Estoy en el ""Taco loco""venden más sopas,carnes, bebidas que tacos solo hay de bistec, pastor y chorizo. ¿Que clase de taco loco es esto?",estoy en el taco locovenden ms sopascarnes bebidas que tacos solo hay de bistec pastor y chorizo que clase de taco loco es esto
-1,Ojala mi princesa no se ponga triste porq no fue su abuela elvira el dia de los abuelos solo su papito chus ella queria q vayan los dos,ojala mi princesa no se ponga triste porq no fue su abuela elvira el dia de los abuelos solo su papito chus ella queria q vayan los dos
1,"@Juanjo90 @CataSolis20 Eso Juan, lleguenle, va a estar divertido. Mucho gusto Cata",eso juan lleguenle va a estar divertido mucho gusto cata
1,"La vez pasada hice una amiga de baño en el Club. Se llamaba Naomi. Saludos Naomi, te tengo presente.",la vez pasada hice una amiga de bao en el club se llamaba naomi saludos naomi te tengo presente
-1,"@CristhianRS ¿? ¿Cuál tema? ¿Cuál manejo? ¿Por qué malísimo? Bueno, si así descalificas a El País, mejor ni discuto contigo. Bs tardes",cul tema cul manejo por qu malsimo bueno si as descalificas a el pas mejor ni discuto contigo bs tardes
-1,@5nfidente No. Era sad y soy bien marica con esas cosas.,no era sad y soy bien marica con esas cosas
1,"@kirazeuss hay nena que tengas un hermoso dia Muy Feliz Cumple ,por muchos años mas ,si Dios quiere",hay nena que tengas un hermoso dia muy feliz cumple por muchos aos mas si dios quiere
1,@Silperpetua que lindo no? Buen dia,que lindo no buen dia
1,"@Alita_ntvg Te amo con todas las letras.. halla y acá. En buenas y no tanto. Ahi estoy, siempre con vos. Como vos conmigo, bombonazo.",te amo con todas las letras halla y ac en buenas y no tanto ahi estoy siempre con vos como vos conmigo bombonazo
-1,"No quiero ir a trabajar #domingodechorreo ""descripción gráfica""",no quiero ir a trabajar domingodechorreo descripcin grfica
-1,"Es que estos dolores, son bárbaros...",es que estos dolores son brbaros
1,@EduardoRamos95R aquí ando me enferme de la garganta jajaja ntp sígue jugando amor te amo mucho! Te extraño popochas,aqu ando me enferme de la garganta jajaja ntp sgue jugando amor te amo mucho te extrao popochas
-1,"""No te puede gustar algo que no sabes hacer"" - Mi pequeño primo Julián, 7 años, sabe más de la vida que yo",no te puede gustar algo que no sabes hacer mi pequeo primo julin 7 aos sabe ms de la vida que yo
-1,@kymposiblee eres bien mala onda,eres bien mala onda
1,Todo depende de ti. La ayuda es buena Pero todo lo que pasa y va a pasar en tu vida va a depender únicamente de vos,todo depende de ti la ayuda es buena pero todo lo que pasa y va a pasar en tu vida va a depender nicamente de vos
-1,@deprotti la ex novia de 30 vrs Sabina para finalmente aceptar que estas viejo,la ex novia de 30 vrs sabina para finalmente aceptar que estas viejo
0,Extraño tener WiFi en las noches y no solo tener fb y wa gratis porque no hablo con nadie,extrao tener wifi en las noches y no solo tener fb y wa gratis porque no hablo con nadie
-1,Que tu primo te llame tan tempranito para que lo ayudes que esta detenido en la comisaria no tiene precio #muerodesueño,que tu primo te llame tan tempranito para que lo ayudes que esta detenido en la comisaria no tiene precio muerodesueo
0,Extraño tener a mis padres juntos,extrao tener a mis padres juntos
1,Pero fue bueno improvisadamente bueno.,pero fue bueno improvisadamente bueno
1,"@PierinaMz Los más buenazos, son los medio gruesitos y cortados de forma vertical. Según yo.",los ms buenazos son los medio gruesitos y cortados de forma vertical segn yo
1,Lo bueno de verano es que en el grupo hay varios compitas,lo bueno de verano es que en el grupo hay varios compitas
0,@unforesto @YurikitoKSP lo dice para hacernos sentir mejor u.u jaja...Pero bueno eres más joven tienes mucho por ver y hacer . Éxitos!,lo dice para hacernos sentir mejor uu jajapero bueno eres ms joven tienes mucho por ver y hacer xitos
0,"@cornejorugel31 ya me imagino su calor que debe estar haciendo allá, ya me imagino negra",ya me imagino su calor que debe estar haciendo all ya me imagino negra
1,@ElMiyashiro @elguilledice @angelabandonado @perudirector @recomienda_pe @Andresilvachuy Ya vere tu peliii exitos,ya vere tu peliii exitos
-1,A todos se les antojo que les hablara a wpp o snap hoy y tengo que recordarles que mi cel esta roto,a todos se les antojo que les hablara a wpp o snap hoy y tengo que recordarles que mi cel esta roto
-1,"no se puede hacer ningun comentario che ,que feo",no se puede hacer ningun comentario che que feo
-1,"@AndreaVasRo @vulturgryphus Otra decepción... (me estoy haciendo la víctima dramática, obvio)",otra decepcin me estoy haciendo la vctima dramtica obvio
-1,Mi horario esta de la fregada voy a vivir en la facu,mi horario esta de la fregada voy a vivir en la facu
-1,@CaELiKe Estuve contigo en la transmisión saludos hermosa quisiera poder vertw y darte un mega abrazo y un besote te quiero,estuve contigo en la transmisin saludos hermosa quisiera poder vertw y darte un mega abrazo y un besote te quiero
0,"Waze renunció a ser guía en le trafico limeño, le llego y se arrancó, Lima y su trafico del mal jaja",waze renunci a ser gua en le trafico limeo le llego y se arranc lima y su trafico del mal jaja
-1,"Que pinche chiste tiene estar ""medio alto"" si todos aquí están bien pigmeos",que pinche chiste tiene estar medio alto si todos aqu estn bien pigmeos
1,"No necesito más, si estoy junto a mi familia. Eternamente agradecida con Ds",no necesito ms si estoy junto a mi familia eternamente agradecida con ds
1,Disfrutando en Uruguay...Ahora esperando a que empiece #LoMejorDeOT en tve internacional,disfrutando en uruguayahora esperando a que empiece lomejordeot en tve internacional
1,"@kanygarcia esaaa la mejor de las suertes! Disfruta la noche, disfruta del #GranRex saludos desde Costa Rica! Buena vida, pura vida!!!",esaaa la mejor de las suertes disfruta la noche disfruta del granrex saludos desde costa rica buena vida pura vida
1,Hoy es el dia perfecto para ir caminando por la calle mientras les ofreces caramelos a los niños chicos...,hoy es el dia perfecto para ir caminando por la calle mientras les ofreces caramelos a los nios chicos
1,"Creo que la sinceridad es importante, pero practicarla es lo principal y más si se promete!",creo que la sinceridad es importante pero practicarla es lo principal y ms si se promete
1,Sólo mi mamá logra por primera vez una cena en paz con TODA la familia Rodríguez Qué feliz soy de tener la madre que tengo,slo mi mam logra por primera vez una cena en paz con toda la familia rodrguez qu feliz soy de tener la madre que tengo
-1,No para nunca de tatuar a Ghi y tengo tremendo sueño,no para nunca de tatuar a ghi y tengo tremendo sueo
1,Me siento tan feliz esta semana cerró bien,me siento tan feliz esta semana cerr bien
-1,"No ire a la facu porque esta muy feo el clima no hay taxis, Uber, mi mama no me quiere llevar, no me quiero mojar, pues me duermo",no ire a la facu porque esta muy feo el clima no hay taxis uber mi mama no me quiere llevar no me quiero mojar pues me duermo
-1,@juanchogerk9 lo peor es que mucha gente vive de vender juguetes y por esto este año les irá mal (día de reyes) todo el centro esta solo,lo peor es que mucha gente vive de vender juguetes y por esto este ao les ir mal da de reyes todo el centro esta solo
1,hoy dia fue un di de genial y de compartir con los niños,hoy dia fue un di de genial y de compartir con los nios
1,"Uruguay es caritativo, nosotros estamos segundos igualmente",uruguay es caritativo nosotros estamos segundos igualmente
-1,Necesito ir a la peluquería pero no quiero ir a un que me deje el pelo horrible como la mayoría,necesito ir a la peluquera pero no quiero ir a un que me deje el pelo horrible como la mayora
1,Me llenas de notificaciones @Sergecast Jajaja #LasChichisDeFichis,me llenas de notificaciones jajaja laschichisdefichis
-1,Una rosa más y estoy a dos de volverme loco,una rosa ms y estoy a dos de volverme loco
1,No muchas cosas me han hecho tan feliz en estos días como darme cuenta que todo Ape in pink marble de Devendra Banhart está en spotify.,no muchas cosas me han hecho tan feliz en estos das como darme cuenta que todo ape in pink marble de devendra banhart est en spotify
-1,@barossi_luzmila cosas de la vida me decis soy la mas fracasada del mundo osea no le cuesta anda un hola que importa que sea famoso,cosas de la vida me decis soy la mas fracasada del mundo osea no le cuesta anda un hola que importa que sea famoso
-1,El problema sera que como iré sola y tenga que ir a hacer algunas cosas durante el día no se a quien le dejare encargado mi sitio,el problema sera que como ir sola y tenga que ir a hacer algunas cosas durante el da no se a quien le dejare encargado mi sitio
-1,@ConsejodePata lcp te da solo una galleta rellenita de 30 céntimos y un vasito de cifrut,lcp te da solo una galleta rellenita de 30 cntimos y un vasito de cifrut
-1,@Adri_tranqui eso ! en no escuchar el despertador ! y te dormís nervioso ...con miedo...y peor es cuando te acostumbraste a dormir tarde,eso en no escuchar el despertador y te dorms nervioso con miedoy peor es cuando te acostumbraste a dormir tarde
1,Se acuerdan de la canción de la 83line y KangIn? La de Ferrari? Era buena,se acuerdan de la cancin de la 83line y kangin la de ferrari era buena
1,"@JuliahdeVince tu ser muy buena maifren, no hay nada que me ponga bien por ahora pero gracias por preocuparte por mí.",tu ser muy buena maifren no hay nada que me ponga bien por ahora pero gracias por preocuparte por m
1,Y otros dias publicare mas para que voten LOS QUIERO MUCHOOOO,y otros dias publicare mas para que voten los quiero muchoooo
0,"@PonyGaJr si algo a si parecia, eso fue raro .__. pero es un video, igual sabemos ellos dos estan juntitos y estan bien",si algo a si parecia eso fue raro pero es un video igual sabemos ellos dos estan juntitos y estan bien
-1,"@ivonnems28 ¿crees? Hahaha obvio si, todos toditos, de todas toditas las personas",crees hahaha obvio si todos toditos de todas toditas las personas
0,Hasta las últimas consecuecias #Abrahamers #Lealtad,hasta las ltimas consecuecias abrahamers lealtad
1,"@byCoba con agua, hielo regularmente para que se mantenga fresca y un poquito de azúcar a la semana, me han durado hasta más de 1 mes.",con agua hielo regularmente para que se mantenga fresca y un poquito de azcar a la semana me han durado hasta ms de 1 mes
-1,Tube que sacarle una tabla al ropero para que renzo ponga su ropa en mi lugar se pasa el pendejo,tube que sacarle una tabla al ropero para que renzo ponga su ropa en mi lugar se pasa el pendejo
-1,"@olivanoticias ahí no van, por que no les gusta el sabor del jamón serrano",ah no van por que no les gusta el sabor del jamn serrano
1,#Stop. Dios es bueno en todo tiempo,stop dios es bueno en todo tiempo
1,Ser el villano de la película es lo mejor,ser el villano de la pelcula es lo mejor
1,"Qué bonito que ""In to my Arms"" sea la segunda canción escuchada este día.",qu bonito que in to my arms sea la segunda cancin escuchada este da
0,La luna está hermosa y justo salí sin celular ptmr,la luna est hermosa y justo sal sin celular ptmr
0,@IvettlyOficial La felicidad también es algo seguro solo debemos buscarla en las pequeñas cosas de la vida.,la felicidad tambin es algo seguro solo debemos buscarla en las pequeas cosas de la vida
0,hay un monton pituelistas en mi inicio q piensan todo lo contrario a mi y no me pongo densa a comentarle todos sus twitts,hay un monton pituelistas en mi inicio q piensan todo lo contrario a mi y no me pongo densa a comentarle todos sus twitts
1,"¡Gran ejemplo a seguir Lennon! inspiradora eeriencia ""De agilista a empresario #devHangout con @lshimokawa @devacademyla""",gran ejemplo a seguir lennon inspiradora eeriencia de agilista a empresario devhangout con
0,lo único que quiero es saber si sharon sabe a quien se refiere rey y si matteo se queda o se va nada más disney #TerminoSoyLuna,lo nico que quiero es saber si sharon sabe a quien se refiere rey y si matteo se queda o se va nada ms disney terminosoyluna
1,"Hoy hice el gol de mi vida, perdimos 8-1 pero hice el gol de mi vida",hoy hice el gol de mi vida perdimos 81 pero hice el gol de mi vida
0,Y si vieras todas las heridas internas quizás entonces me entiendas,y si vieras todas las heridas internas quizs entonces me entiendas
1,@AnimeMariana jajaa Pos yo igual queria verte cantar!!! :'''v Hubiera estado lindo. Pero pos creo que lo de 50 cosas seria algo genial,jajaa pos yo igual queria verte cantar v hubiera estado lindo pero pos creo que lo de 50 cosas seria algo genial
-1,No es bonito estar sin celular,no es bonito estar sin celular
1,@LiaTitoo Graciaas!! Vos también te lo merecías Fue re lindo tener una compañera como vos,graciaas vos tambin te lo merecas fue re lindo tener una compaera como vos
1,Mi hermano está templadaso y se me hace tan lindo,mi hermano est templadaso y se me hace tan lindo
-1,En Heredia ese temblor se sintió leve pero horrible,en heredia ese temblor se sinti leve pero horrible
0,@Bryanpinarivera @EvaMPT @diegorrc el I no entra en el Machete y el VII tampoco porque aún no se sabe el rumbo de la nueva trilogía,el i no entra en el machete y el vii tampoco porque an no se sabe el rumbo de la nueva triloga
0,Y estavamos los dos buscando la manera de desir quien de los dos da el primer paso.!! #ESCUCHANDO #DOSOGAS Sola En Casa...,y estavamos los dos buscando la manera de desir quien de los dos da el primer paso escuchando dosogas sola en casa
-1,"Que ganas de estrellar un ladrillo en la cabeza de mi jefe, tirar la puta computadora por la ventana y quemar el lugar",que ganas de estrellar un ladrillo en la cabeza de mi jefe tirar la puta computadora por la ventana y quemar el lugar
0,"Hasta lo peor de mi, quiere lo mejor para ti",hasta lo peor de mi quiere lo mejor para ti
1,"En 15 minutos, subiré un nuevo video a mi canal de youtube, es un pequeño regalo para que se lo empiecen a pasar de agasajo este viernes!",en 15 minutos subir un nuevo video a mi canal de youtube es un pequeo regalo para que se lo empiecen a pasar de agasajo este viernes
0,@unforesto @YurikitoKSP lo dice para hacernos sentir mejor u.u jaja...Pero bueno eres más joven tienes mucho por ver y hacer . Éxitos!,lo dice para hacernos sentir mejor uu jajapero bueno eres ms joven tienes mucho por ver y hacer xitos
-1,son los huevos más pobres que me he comido,son los huevos ms pobres que me he comido
-1,Neta que mi novio se fue al santo a esta hora? Pa' esos novios mejor ando conmigo misma ya que soy bien antrera,neta que mi novio se fue al santo a esta hora pa esos novios mejor ando conmigo misma ya que soy bien antrera
0,"Mañana es, posiblemente, el último encuentro de Natura que dirija y Enero ya empezar en Yanbal",maana es posiblemente el ltimo encuentro de natura que dirija y enero ya empezar en yanbal
1,Claro @SarahnChile El networking y creación de contactos siempre ayuda para futuras oportunidades de negocio y trabajo,claro el networking y creacin de contactos siempre ayuda para futuras oportunidades de negocio y trabajo
0,Lo bueno que nadamas es esta semana,lo bueno que nadamas es esta semana
1,"@Gloryagpem @karench0708 ayer andábamos por allá jaja, le diré que vayamos mañana a ver si me dejan gracias lindas",ayer andbamos por all jaja le dir que vayamos maana a ver si me dejan gracias lindas
-1,Me acosté súper tarde ayer (para mis horarios normales) y ahora no puedo seguir durmiendo porque no aguanto el calor de estas horas,me acost sper tarde ayer para mis horarios normales y ahora no puedo seguir durmiendo porque no aguanto el calor de estas horas
1,"Amigos, mi pavo huele buenazo. Y si se lo estan preguntando. Sí. Es la 1ra vez que lo hacemos.",amigos mi pavo huele buenazo y si se lo estan preguntando s es la 1ra vez que lo hacemos
-1,No voy a poder ver a mi mamá el día de la madre. Por un hijo de la grandísima puta. Bien,no voy a poder ver a mi mam el da de la madre por un hijo de la grandsima puta bien
1,"@SilvioCABJ12 Vamos! a más viejitas mejor, pero no se por quién apostas?!",vamos a ms viejitas mejor pero no se por quin apostas
0,"@H_E_Y ya ahí si no sabría decirte generalmente siempre hace sol temprano, se llega a poner nublado es como luego de las 3pm.",ya ah si no sabra decirte generalmente siempre hace sol temprano se llega a poner nublado es como luego de las 3pm
-1,@natyrodriguez Demasiada decepción con la humanidad,demasiada decepcin con la humanidad
-1,"@KimSalas21 La vida conspira en contra de uno, que injusto jaja.",la vida conspira en contra de uno que injusto jaja
-1,"Mi imposible quiere irse a Europa. Yo tenía pequeñas esperanzas sabiendo que era imposible, pero ahora se las lleva para Europa",mi imposible quiere irse a europa yo tena pequeas esperanzas sabiendo que era imposible pero ahora se las lleva para europa
-1,"Como cuando duermo de día y de noche ando bien pilas, esto es fantástico",como cuando duermo de da y de noche ando bien pilas esto es fantstico
-1,Les juro que lo stalkeo y mi instinto asesino se activa.,les juro que lo stalkeo y mi instinto asesino se activa
1,"@mishafantana si obvio eso es lo importante, gracias por preguntar",si obvio eso es lo importante gracias por preguntar
-1,La ptm no supero lo de ayer Mi año nuevo se fue a la mrd,la ptm no supero lo de ayer mi ao nuevo se fue a la mrd
-1,Ya no es tan divertido,ya no es tan divertido
1,"Amigos, neta muy neta, hay una probabilidad de irme pa la CDMX, alcen las manos y pídanle a Diosito",amigos neta muy neta hay una probabilidad de irme pa la cdmx alcen las manos y pdanle a diosito
-1,Todo pudo ser tan bonito,todo pudo ser tan bonito
1,"Eres bien divertida y me das mucha risa, siempre andas de buenas y eso me agrada, eres muy buena persona, ya no tengas tantos crushes",eres bien divertida y me das mucha risa siempre andas de buenas y eso me agrada eres muy buena persona ya no tengas tantos crushes
1,"@ContactoCitibmx en la mañana habían retenido la compra en linea porque pensaban que era fraude con la tarjeta, pero ya lo resolvieron.",en la maana haban retenido la compra en linea porque pensaban que era fraude con la tarjeta pero ya lo resolvieron
-1,"@Valezka38 dolor sería ser chileno, la mugre de América. Chupapijas de los ingleses y del pinocho. Cero copa mundial. Saluditos.",dolor sera ser chileno la mugre de amrica chupapijas de los ingleses y del pinocho cero copa mundial saluditos
1,"@Ka_Arroyo_ y cómo mezclan realidad con mundos paralelos, y que es diferente a las demás películas de Marvel",y cmo mezclan realidad con mundos paralelos y que es diferente a las dems pelculas de marvel
1,"@emarlyworld feliz sabado para ti tbm,a los tiempos entro al twitter y es agradable que a la primera persona que vea, sea a ti !!!",feliz sabado para ti tbma los tiempos entro al twitter y es agradable que a la primera persona que vea sea a ti
-1,"@odiomistweets No puede ser, eso me está pasando en estos momentos, hace rato estaba good happy y ahora solo i cry",no puede ser eso me est pasando en estos momentos hace rato estaba good happy y ahora solo i cry
-1,@walkiriaflor Pues no estaba bromenado,pues no estaba bromenado
1,Lo bueno de esta Navidad es que la pase junto a JC y mi mamá lo conoció en persona,lo bueno de esta navidad es que la pase junto a jc y mi mam lo conoci en persona
