polarity,content,content_clean
-1,@Yo_Soy_B es que aquí no hay así que diga edificios y lugares históricos y los que hay son como 3 y ya no esta chido por eso lo digo.,es que aqu no hay as que diga edificios y lugares histricos y los que hay son como 3 y ya no esta chido por eso lo digo
-1,"En Curridabat muy calmado, ni una gota de agua y hasta caliente está 20°v... #nomegusta",en curridabat muy calmado ni una gota de agua y hasta caliente est 20v nomegusta
1,"Un señor toca bien bonito, pero apenas traigo para mi pasaje",un seor toca bien bonito pero apenas traigo para mi pasaje
-1,Prefiero Lamentarme Solo Lo Que Esta Pasando,prefiero lamentarme solo lo que esta pasando
-1,La de las indirectas soy yo. Perdón.,la de las indirectas soy yo perdn
-1,o sea ... me urge un Dr. @Rocktor101 (escuchó un programa de males digestivos y así),o sea me urge un dr escuch un programa de males digestivos y as
0,@diegodelagos Ayer la gente de mi FB se portó mejor que la de mi TL de TW en relación con el tema de los himnos...,ayer la gente de mi fb se port mejor que la de mi tl de tw en relacin con el tema de los himnos
1,"@abdielsmusic #TeamAbdiel #barbies no hay mejor cover que este, en realidad todo es hermoso con tu voz",teamabdiel barbies no hay mejor cover que este en realidad todo es hermoso con tu voz
1,creo que ambos nos seguimos leyendo pues bueno espero estés bien y poder conversar en algún momento éxitos en todo y vibras,creo que ambos nos seguimos leyendo pues bueno espero ests bien y poder conversar en algn momento xitos en todo y vibras
1,"Nunca esperes nada bueno de Nadie , es mas bonito vivir así.",nunca esperes nada bueno de nadie es mas bonito vivir as
1,"Paaah, extrañaba tanto a Ezee... Estaba re perdido.",paaah extraaba tanto a ezee estaba re perdido
1,Lo bueno de esta Navidad es que la pase junto a JC y mi mamá lo conoció en persona,lo bueno de esta navidad es que la pase junto a jc y mi mam lo conoci en persona
-1,"Lo triste de las vacaciones, es cuando haces maletas para regresar a la rutina.",lo triste de las vacaciones es cuando haces maletas para regresar a la rutina
-1,@La_Llama_ @DosPinosOficial tengo que probarlo. Estoy decepcionado. Ahora el fresco leche sabe a puro sirope.,tengo que probarlo estoy decepcionado ahora el fresco leche sabe a puro sirope
0,"@Camula7 Ese es el uno dos ideal, pero Rosita la embarra y la queda Olivia y el l bobeta obvio.",ese es el uno dos ideal pero rosita la embarra y la queda olivia y el l bobeta obvio
0,Imposible no subir de peso aquí ( Chiclayo y sus comidas ),imposible no subir de peso aqu chiclayo y sus comidas
-1,Estoy twitteando mucho para olvidarme que cerca de casa esta lleno de cosas voladas y tengo el mar a punto de romperme la ventana,estoy twitteando mucho para olvidarme que cerca de casa esta lleno de cosas voladas y tengo el mar a punto de romperme la ventana
-1,se ve que no me conocen ni un poquito,se ve que no me conocen ni un poquito
1,"El amor es paciente, es bondadoso, no es envidioso ni orgulloso, no es egoísta, no guarda rencor. 1 Corintios 13:4-5 Buen día a todos",el amor es paciente es bondadoso no es envidioso ni orgulloso no es egosta no guarda rencor 1 corintios 1345 buen da a todos
-1,Me he puesto nervioso por la función de mañana. Y si me da una laguna mental??? Mierda ahora no puedo dejar de pensar en eso,me he puesto nervioso por la funcin de maana y si me da una laguna mental mierda ahora no puedo dejar de pensar en eso
-1,Ya extraño a mi mamá y todavia no me voy,ya extrao a mi mam y todavia no me voy
0,"@RenzoMirandaQ JAJAJAJAJAJAJAJA ¿estás racista, Rosado? Blanquito y todo te acepto, así me discrimines por negra",jajajajajajajaja ests racista rosado blanquito y todo te acepto as me discrimines por negra
1,"@CarmenLo19 hola Carmen!! Es una aplicación para ver películas y series! Bien completa es, incluso hay de las que están en estreno en HD.",hola carmen es una aplicacin para ver pelculas y series bien completa es incluso hay de las que estn en estreno en hd
-1,@Danaloby Gente como tu mediocres y matoncitos. Que se puede esperar de los fujiratas.,gente como tu mediocres y matoncitos que se puede esperar de los fujiratas
1,@Lascosas690 EXCELENTE lo de Axel contando como se termina con DELINCUENTES en fútbol. ¿Cuándo repiten programa para grabar y amplificar?,excelente lo de axel contando como se termina con delincuentes en ftbol cundo repiten programa para grabar y amplificar
1,"@IvettlyOficial Yo igual, recuerdo que siempre te estaré apoyando en todo, a pesar de la distancia, siempre estaré aquí.",yo igual recuerdo que siempre te estar apoyando en todo a pesar de la distancia siempre estar aqu
1,"@cuervotinelli el 27 de diciembre tengo mi primer sesión, luego el 11 de enero... NECESITO HACER ESTO POR MI PARA SENTIRME PLENO !!",el 27 de diciembre tengo mi primer sesin luego el 11 de enero necesito hacer esto por mi para sentirme pleno
1,"Tener grandes eectativas a futuro, eso es vida",tener grandes eectativas a futuro eso es vida
1,"@SoyUnaPolylla mmm. Es guapo, pero me quedo con el otro chibolo porque tiene cara de pastrulo (y es pastrulo).",mmm es guapo pero me quedo con el otro chibolo porque tiene cara de pastrulo y es pastrulo
-1,@AndreaLuzuriaga me rompisteS el corazón! es una discusión ardua la del horario; no podés acomodar para entrar a las 11 algunos días?,me rompistes el corazn es una discusin ardua la del horario no pods acomodar para entrar a las 11 algunos das
-1,"""Contigo porque me matas y ahora sin ti ya no vivo"" -->Tal cual! Te mereces todo lo que has conseguido y conseguirás @AbrahamMateoMus",contigo porque me matas y ahora sin ti ya no vivo tal cual te mereces todo lo que has conseguido y conseguirs
1,@UnZorro88 a mí me gustan de hecho,a m me gustan de hecho
1,"@cotarola Te mando un abrazo. Vienen días duros, pero se superan eventualmente",te mando un abrazo vienen das duros pero se superan eventualmente
1,"Que bonito es anunciar que los excedentes de la Asociación Solidarista, ya estan depositados",que bonito es anunciar que los excedentes de la asociacin solidarista ya estan depositados
1,@FexCR ufff una cosa deliciosa!! Jajaja Que desorden ! Metí las patas ser feliz Fexito!!!,ufff una cosa deliciosa jajaja que desorden met las patas ser feliz fexito
0,Llegan tiempos difíciles y lo único que me queda es afrontarlos y seguir adelante,llegan tiempos difciles y lo nico que me queda es afrontarlos y seguir adelante
0,Jessica me hiso cambiar el perfil de wspp -. Y poner una foto con ella,jessica me hiso cambiar el perfil de wspp y poner una foto con ella
0,@cuervotinelli Podes hablar con el Gurca?? YO SOY PUNTUAL !!,podes hablar con el gurca yo soy puntual
0,Buen día!!!..toda hecha mierda gripe maldita pero..bañito y a trabajar se a dicho..,buen datoda hecha mierda gripe maldita perobaito y a trabajar se a dicho
0,Encima tengo muchas fotos juntos,encima tengo muchas fotos juntos
-1,"Estoy tan sad pero tan sad de los conciertos anunciados a los cuales no iré y la pinche Ruby con su guitarra, me deberían patrocinar a mi",estoy tan sad pero tan sad de los conciertos anunciados a los cuales no ir y la pinche ruby con su guitarra me deberan patrocinar a mi
1,"Siempre me han dicho que la relación que tengo con mi papá es muy bonita, es por que siempre solo nos hemos tenido el uno al otro",siempre me han dicho que la relacin que tengo con mi pap es muy bonita es por que siempre solo nos hemos tenido el uno al otro
1,"@emy_9810 jajajaja ya con menos carga es mejor , relajas mas",jajajaja ya con menos carga es mejor relajas mas
1,@MateoFernandezE Esperare ese momento desde el Primer capitulo dije qué mateo es el indicado para la anita,esperare ese momento desde el primer capitulo dije qu mateo es el indicado para la anita
-1,"Extraño los tacos de ""El vaquero""",extrao los tacos de el vaquero
-1,No agarro unas pairas hace mas de una semana mi melodica mucho menos,no agarro unas pairas hace mas de una semana mi melodica mucho menos
-1,@elsamariadelca1 ESCRITO de él para estos días 2Tes:2:9)con GRAN PODER y señales y prodicios mentirosos( ILISIONES fornicarias Ap:18,escrito de l para estos das 2tes29con gran poder y seales y prodicios mentirosos ilisiones fornicarias ap18
0,@WancitoCubero horrible muy buena pero devastadora,horrible muy buena pero devastadora
-1,Ya estoy estresada de esperar resultados,ya estoy estresada de esperar resultados
-1,Ando bien adolorido de mi espalda,ando bien adolorido de mi espalda
1,"@Fridaricky así como estas... Primero abajo, pero comiendo panochita suave, y luego atrás para dejarte la ir muy duro! Qué rico",as como estas primero abajo pero comiendo panochita suave y luego atrs para dejarte la ir muy duro qu rico
-1,@grassengel no podés tener lo mejor de los dos mundos,no pods tener lo mejor de los dos mundos
1,"@Jimmychinchay @canalN_ bien sra presidenta, se predica con el ejm, muy bien!!!!",bien sra presidenta se predica con el ejm muy bien
-1,"si no veo a lali este miercoles no la veo mas, tengo tremenda mala suerte siempre",si no veo a lali este miercoles no la veo mas tengo tremenda mala suerte siempre
-1,"Ya estoy en mi casa maigues, no morí. Bien pinche adolorida pero ya en mi casita. Pd. Me quieren llevar al rancho pero yo no quiero",ya estoy en mi casa maigues no mor bien pinche adolorida pero ya en mi casita pd me quieren llevar al rancho pero yo no quiero
0,@ysareth LA delicia! Mi mamá casi no me deja meter a los gatos Pero les encanta dormir aquí cuando pueden,la delicia mi mam casi no me deja meter a los gatos pero les encanta dormir aqu cuando pueden
-1,"Yo también podría subir las fotos de mis comidas y juguitos fit, mi rutina en el gym but ¿Cúal es el fin? #genteposera #FelizJueves",yo tambin podra subir las fotos de mis comidas y juguitos fit mi rutina en el gym but cal es el fin genteposera felizjueves
-1,"Casi el 80% de los pobladores estamos mal ubicados, en un terremoto estiman 50 mil muertos en Lima",casi el 80 de los pobladores estamos mal ubicados en un terremoto estiman 50 mil muertos en lima
-1,@conoche repollo Ud últimamente como que muy amargo,repollo ud ltimamente como que muy amargo
-1,"Decepcionado , este dolor ya lo tengo acostumbrado",decepcionado este dolor ya lo tengo acostumbrado
1,"Mañana va a haber muchos niñitos con una primer patineta. Si ven a uno, apoyen y ayudenlo. Estará frente a ustedes un nuevo skateboard.",maana va a haber muchos niitos con una primer patineta si ven a uno apoyen y ayudenlo estar frente a ustedes un nuevo skateboard
0,"@IvancitoMavelk no estaba de caliente, iba a componer algo con alguien",no estaba de caliente iba a componer algo con alguien
1,@randeles Que buena foto! Felicidades,que buena foto felicidades
0,@degadiana_ @ErickBrianColon pero no entiendo porque no tiene sonido igual espero que te haya gustado Yo tambien lo amo,pero no entiendo porque no tiene sonido igual espero que te haya gustado yo tambien lo amo
-1,Antes el Matsuri era gratis despues subio a 10S/. Ahora 20S/ y ahora es limitado Ya nada sera como antes...,antes el matsuri era gratis despues subio a 10s ahora 20s y ahora es limitado ya nada sera como antes
1,Madurar es mas divertido contigo,madurar es mas divertido contigo
1,Ay qué bonito todo! Demasiado extraño no estar sufriendo a estas alturas Vamos Seleeeeee,ay qu bonito todo demasiado extrao no estar sufriendo a estas alturas vamos seleeeeee
-1,"Ganas de pasar todo el día acostada como ayer me sobran, pero tengo clase",ganas de pasar todo el da acostada como ayer me sobran pero tengo clase
-1,"@LilieMayen es en Marzo, ¿no? es que voy a ir con mi novia",es en marzo no es que voy a ir con mi novia
-1,@CARLOSEES Yo le dije que quería un beso suyo y me rechazó. No te sientas tan triste jajaja,yo le dije que quera un beso suyo y me rechaz no te sientas tan triste jajaja
-1,"Iba a escribir algo inspirador para este cierre de año, pero con un simple y sincero: ""deschinguen a su madre todos"" es suficiente.",iba a escribir algo inspirador para este cierre de ao pero con un simple y sincero deschinguen a su madre todos es suficiente
-1,@fernando_amado Estoy ofendido de que ni @Chasquetti ni @Constanza_FA hayan querido reclutarme. No logré llegar a estándares soviéticos,estoy ofendido de que ni ni hayan querido reclutarme no logr llegar a estndares soviticos
0,"Estoy con todos los sentimientos, odio las despedidas y hoy estaré muy emocional. Con fe mi último día aquí y nuevos retos por venir",estoy con todos los sentimientos odio las despedidas y hoy estar muy emocional con fe mi ltimo da aqu y nuevos retos por venir
-1,"@RufinaCamejo Si fuera mal pensado, diría que es un arreglo entre el pintor y ellos para cobrar más @CesarAMartinezR",si fuera mal pensado dira que es un arreglo entre el pintor y ellos para cobrar ms
1,En mi pueblo anda una patrulla de @fuerzapublicaCR recolectando alimentos no perecederos. En mi casa ya donamos #CostaRicaUnida,en mi pueblo anda una patrulla de recolectando alimentos no perecederos en mi casa ya donamos costaricaunida
-1,"@cmenghi A menos q seas empleado de Riogas, Alur, INR, IMPO, vicepresidencia o cosas así. Tener título está sobrevalorado @Nico_Selser",a menos q seas empleado de riogas alur inr impo vicepresidencia o cosas as tener ttulo est sobrevalorado
-1,"La edad me trae fugas... de sentimientos, buen juicio, buen gusto, sentido común, prudencia y cortesía. La incontinencia aún no me llega",la edad me trae fugas de sentimientos buen juicio buen gusto sentido comn prudencia y cortesa la incontinencia an no me llega
-1,Hay un grupo de estudio religioso en el sótano y están haciendo un bullón increíble. Yo sólo quiero ver mi película de putas,hay un grupo de estudio religioso en el stano y estn haciendo un bulln increble yo slo quiero ver mi pelcula de putas
-1,Mi mamá sólo decirme que estoy gorda,mi mam slo decirme que estoy gorda
0,@Natsflorees le di sus respectivos buenos días desde las 7am y ya estaba así jajaj no soy yo jajajaj,le di sus respectivos buenos das desde las 7am y ya estaba as jajaj no soy yo jajajaj
1,"Desayuno guanacasteco Hoy es Nochebuena, hoy damos vueltita por Nicoya",desayuno guanacasteco hoy es nochebuena hoy damos vueltita por nicoya
-1,He subido 3 kilos OMG !!!! Son los resultados de la navidad,he subido 3 kilos omg son los resultados de la navidad
1,"ONQ16, IBExams, Grad.PrepaTec, VemRD, Grad.IB, ITESM INQ, EMRIA. Fue un buen año #2016 y el que viene, mejor!!",onq16 ibexams gradprepatec vemrd gradib itesm inq emria fue un buen ao 2016 y el que viene mejor
0,"@pochiitto por qué no, puedes hacer una alterna.",por qu no puedes hacer una alterna
1,mañana tengo el día libre y no tengo nada más que hacer que dormir,maana tengo el da libre y no tengo nada ms que hacer que dormir
1,"Pacífico (cerveza) Mariscos Gustavo Cerati de Fondo *no es la Paz BJS, son las playas de los Reyes la Paz, de este hermoso estado de MX",pacfico cerveza mariscos gustavo cerati de fondo no es la paz bjs son las playas de los reyes la paz de este hermoso estado de mx
0,@MauHCorona Lo normal es aburrido.,lo normal es aburrido
0,"@skparedes @SheyJacobo y eso que es el primer dia , mañana con fe",y eso que es el primer dia maana con fe
1,"@Vane_Arcia Sí, era justo y necesario. Lo hice y me siento mejor",s era justo y necesario lo hice y me siento mejor
1,"@ItzeelF18 ¡Con mucho gusto! De entrada, por aquí los mejores deseos para el año que ya llega.",con mucho gusto de entrada por aqu los mejores deseos para el ao que ya llega
-1,"@ticotraveleando ingrato, solo porque usted sí",ingrato solo porque usted s
-1,Hacer un inventario forestal es horrible con tanto sol. Me arde todo,hacer un inventario forestal es horrible con tanto sol me arde todo
1,#BuenosDias mundo Twittero ya desperté y estoy listo para vivir un dia mas #ExcelenteMartes,buenosdias mundo twittero ya despert y estoy listo para vivir un dia mas excelentemartes
0,Imposible no subir de peso aquí ( Chiclayo y sus comidas ),imposible no subir de peso aqu chiclayo y sus comidas
-1,@elrifle @JessicaSolano la costra me da cosas. Pero qué lindo por la enfermerita.,la costra me da cosas pero qu lindo por la enfermerita
1,Delicioso @ San Rafael Ezcazu,delicioso san rafael ezcazu
0,"Yo no le deseo el mal a nadie, pero a veces se agradece, que todo caiga por su propio peso.....:.. Muy buenos días tengan todosssss usted",yo no le deseo el mal a nadie pero a veces se agradece que todo caiga por su propio peso muy buenos das tengan todosssss usted
-1,@Yeesus_ @laMaquinaPeru @CSerranoTV ya no es lo mismo,ya no es lo mismo
0,Cuando todo es felicidad y falla un sector del disco de la laptop y se borran archivos muy importantes de la chamba,cuando todo es felicidad y falla un sector del disco de la laptop y se borran archivos muy importantes de la chamba
1,@JKsSpicyLatina Espero que la hayas pasado lindo,espero que la hayas pasado lindo
-1,15 días sin uno de esos abrazos mágicos,15 das sin uno de esos abrazos mgicos
-1,Feo es estar enfermo con gripe a esta alta temperatura de tarapoto,feo es estar enfermo con gripe a esta alta temperatura de tarapoto
-1,Mi amigo me va a odiar por dejarlo plantado Porque le dije que íbamos a ir a una peda y pues ya no me dieron chance,mi amigo me va a odiar por dejarlo plantado porque le dije que bamos a ir a una peda y pues ya no me dieron chance
-1,@edgumaco yo siempre deseo eso y cuando estoy libre;como hoy> ando desde temprano dando vueltas y sin sueño,yo siempre deseo eso y cuando estoy librecomo hoy ando desde temprano dando vueltas y sin sueo
0,"@Andresdarmas2 jeje si podes, como uno de los cupos de menores que se permiten",jeje si podes como uno de los cupos de menores que se permiten
-1,"Me da culo caminar de noche por anahuac city, ni pedo, gym time",me da culo caminar de noche por anahuac city ni pedo gym time
-1,#LaPoderosaKeiko solo puede tener poder en el 4to país más ignorante del mundo: Perú,lapoderosakeiko solo puede tener poder en el 4to pas ms ignorante del mundo per
0,"@sinceratops no me dijo nada nuevo, tranqui jaja. Si ve más bolsos lindos me los recomienda también, porfa",no me dijo nada nuevo tranqui jaja si ve ms bolsos lindos me los recomienda tambin porfa
1,@IsabelPalomar espero que te mejores,espero que te mejores
1,"@Solenrivero Buen dia soleee!! LLegue temprano si, trabajo poco esta semana asi que ta, hago un esfuerzo",buen dia soleee llegue temprano si trabajo poco esta semana asi que ta hago un esfuerzo
1,@camilacabello97 siempre junto a ti espero verte en peru denuevo como solista,siempre junto a ti espero verte en peru denuevo como solista
-1,@CJSuasnabar soy el perro asesinado,soy el perro asesinado
0,"@barbaycanas es que ya no era necesario llamar ,ya sabiamos lo que espera ,la proxima sera",es que ya no era necesario llamar ya sabiamos lo que espera la proxima sera
-1,Me muero de sueño. Es demasiado tiempo sentada,me muero de sueo es demasiado tiempo sentada
-1,"PONTE BONITA 5 DE ENERO .. No es Twitter, algo está mal con el ht o se hizo spam, ya fue",ponte bonita 5 de enero no es twitter algo est mal con el ht o se hizo spam ya fue
1,@BreNdiiuXx @BaldiHotSpring1 ya se no quería salirme de las aguas termales mañana voy a Monteverde a ver que tal,ya se no quera salirme de las aguas termales maana voy a monteverde a ver que tal
0,"Ni siquiera subi a la montaña mas alta porque ""es muy peligroso"" solo el camino es angosto, oe, yo queria mi foto con la llama",ni siquiera subi a la montaa mas alta porque es muy peligroso solo el camino es angosto oe yo queria mi foto con la llama
1,@cuervotinelli @elchatoprada @hoppefede @ElchuecoSuar Buenos días !! ...,buenos das
1,@rickymanjarrez miraré el programa completo y ya esta gracias me encanto lo que escribiste sobre marc y jlo en la foto q RT Gracias!!,mirar el programa completo y ya esta gracias me encanto lo que escribiste sobre marc y jlo en la foto q rt gracias
-1,"@andreacarcamo7 solo vi hasta los primeros caps de esa temporada y me re decepcionó, tan buena que era la serie y la aburrieron",solo vi hasta los primeros caps de esa temporada y me re decepcion tan buena que era la serie y la aburrieron
-1,@eli_rivas10 @Madonna @pedrosola @chabelooficial @LAURAZAPATAM JAJAJAJAJAJA ay te extraño,jajajajajaja ay te extrao
0,@shxwngold uy jajjaa bueno lo siento,uy jajjaa bueno lo siento
-1,@Silperpetua era mas facil armar bardo,era mas facil armar bardo
1,Estoy feliz xq esta lloviendo,estoy feliz xq esta lloviendo
0,"@GaboJimenex jajaja. Yo me pegué el susto de la vida, y luego la espera por meterlo al taller de iCon. Pero ya está vivo.",jajaja yo me pegu el susto de la vida y luego la espera por meterlo al taller de icon pero ya est vivo
-1,"OMFG mi conductor de uber acaba de pasar por un bache gigante y ahora el coche va haciendo ruidos raros. Pobre, le va a costar carísimo.",omfg mi conductor de uber acaba de pasar por un bache gigante y ahora el coche va haciendo ruidos raros pobre le va a costar carsimo
-1,En la clase de circo de hoy: cáigase de la pelota gigante y rómpase un diente,en la clase de circo de hoy cigase de la pelota gigante y rmpase un diente
-1,Las tenis blancas no se usan todos los días,las tenis blancas no se usan todos los das
0,Ya extraño romperle las bolas y peliarlas ya se que me extrañan tambien,ya extrao romperle las bolas y peliarlas ya se que me extraan tambien
0,@wkCArlos yo soy igual Jajajaja trató de evitarlo pero no lo logro,yo soy igual jajajaja trat de evitarlo pero no lo logro
1,"@vesamo13 ok, vea el lado positivo, tiene un motivo para hacerle drama el resto de si vida.",ok vea el lado positivo tiene un motivo para hacerle drama el resto de si vida
-1,"@tenyexrsgone A mi me jode bastante eso créeme, y mas aun que de acá ni del hotel salieran, no se porque siempre lo mismo",a mi me jode bastante eso creme y mas aun que de ac ni del hotel salieran no se porque siempre lo mismo
-1,@AlbertoVill descubri que soy celosa,descubri que soy celosa
-1,Que genial ir parada a minas,que genial ir parada a minas
0,"@raticorns Genial!, pero yo decia del pais que mas te ve El aceite de coco creo q no es tan facil de conseguir",genial pero yo decia del pais que mas te ve el aceite de coco creo q no es tan facil de conseguir
0,No sé qué onda con spotify que ya llevo escuchando medio disco de serge y no me sale ninguna publicidad. Cómo engatuzan a l pobres,no s qu onda con spotify que ya llevo escuchando medio disco de serge y no me sale ninguna publicidad cmo engatuzan a l pobres
-1,@NeckoLol Eu necko que lastima el lunes no se si me puedo quedar hasta tarde :u es dia de semana tengo liceo (secundaria),eu necko que lastima el lunes no se si me puedo quedar hasta tarde u es dia de semana tengo liceo secundaria
1,#fiestazomegastar ¿ Qué piensas de que muchisimas abrahamers uruguayas viajan a Argentina para verte brillar ? ..... Uruguay te ama,fiestazomegastar qu piensas de que muchisimas abrahamers uruguayas viajan a argentina para verte brillar uruguay te ama
0,Hola me complacerían con #ParaOlvidarte de @MauYRicky por faaaaa Saludos desde Liberia @azul999fm,hola me complaceran con paraolvidarte de por faaaaa saludos desde liberia
0,"Empezó el tercer y último turno que acaba mańana a las 7 am. El ambiente está más caliente que semanás atrás. Bueno, es la primavera!",empez el tercer y ltimo turno que acaba maana a las 7 am el ambiente est ms caliente que semans atrs bueno es la primavera
-1,"¿Cómo que no voy a ver a Sputnik, tampoco me voy a ir a aguascalientes, los Rebel ya tocaron y a Little va mi ex? Y los boletos de la WWE",cmo que no voy a ver a sputnik tampoco me voy a ir a aguascalientes los rebel ya tocaron y a little va mi ex y los boletos de la wwe
1,"@Djrossana que tengan un lindo martes y que todos tus sueños se hagan realidad Sé tu misma, No copies Modas Eres Mi ejemplo a seguir",que tengan un lindo martes y que todos tus sueos se hagan realidad s tu misma no copies modas eres mi ejemplo a seguir
-1,"Gracias al imbécil que tiró la botella me quedé sin cancha hoy ,mal vos pelotudo .",gracias al imbcil que tir la botella me qued sin cancha hoy mal vos pelotudo
1,"@pwoblematique la edad jajaja ntc, pues no sé, supongo es normal digamos q me pasó igual pero con los videojuegos encontré mi máximo",la edad jajaja ntc pues no s supongo es normal digamos q me pas igual pero con los videojuegos encontr mi mximo
-1,"Llegue a casa, había una caja q me mandó la ex y dentro estaba mi amada PS3 (Los niños sonríen) Pero no trae control (Los niños lloran)",llegue a casa haba una caja q me mand la ex y dentro estaba mi amada ps3 los nios sonren pero no trae control los nios lloran
1,@szerenata toda la suerte del mundo en tu nuevo proyecto /espacio / hora . Te quiero mucho amiga mía . #mty #orgullo,toda la suerte del mundo en tu nuevo proyecto espacio hora te quiero mucho amiga ma mty orgullo
1,"me gustaría volver a sentir q tu me miras, sentirse la única persona en tu vida, rozar tu cuerpo sin preocupación alguna y ver como me",me gustara volver a sentir q tu me miras sentirse la nica persona en tu vida rozar tu cuerpo sin preocupacin alguna y ver como me
-1,que contracturado tengo el cuello,que contracturado tengo el cuello
-1,"@Sofiabubble sí para las propias, pero para andar hurgando en las cuentas de otros?",s para las propias pero para andar hurgando en las cuentas de otros
-1,"@Mausaga vieras dolor jure nunca más volver a ese lugar, queda en PZ para los interesados",vieras dolor jure nunca ms volver a ese lugar queda en pz para los interesados
-1,@Alfredo_Bruno Mi formación científica me hace ver un vaso inadaptado a la realidad,mi formacin cientfica me hace ver un vaso inadaptado a la realidad
